title,text,subject,date,isfake
"After London setback, May wins Brexit cheer in Brussels",british prime minist theresa may made clear desir thursday move brexit talk forward discuss futur trade relationship dinner eu leader applaud progress made far a day suffer defeat parliament blueprint quit eu may told peer summit brussel cours deliv brexit urg speed talk unravel year union offer reassur endors friday launch second phase negoti free trade pact initi transit period leader respond may remark brief round applaus leav summit allow discuss brexit without her a british govern offici said prime minist made secret want move next phase approach ambit creativ i believ best interest uk european union told leader dinner roast langoustin capon chicken a particular prioriti agreement implement period bring greater certainti busi uk across ad offici said german chancellor angela merkel congratul may bring negoti last week stage suffici progress enabl leader accept open next phase talk summit chair donald tusk call may friday updat leader discuss next move brexit may weaken lose conserv parti major june elect far carri divid govern parti negoti first phase talk much britain pay leav eu border ireland statu eu citizen britain but second decis phase negoti test author expos deep rift among top team minist cabinet britain becom brexit acknowledg tough talk ahead tusk warn uniti display far would deliv good deal trade issu member state differ interest i doubt real test uniti second phase brexit talk told report may team upbeat look achiev far the deal phase one mani comment said done done british govern offici said look languag european leader today all signal look forward continu negoti prime minist the eu will start talk next month roughli twoyear transit period eas britain march want detail london want open trade negoti march the deal almost fell apart last week may northern irish alli reject initi agreement fear promis protect free border eu member ireland could separ region rest uk after day often fraught diplomaci may rescu deal meet eu requir suffici progress lastminut wobbl democrat unionist parti depend parliament get law pass defeat parliament wednesday underlin struggl face i disappoint amend told report arriv summit but eu withdraw bill make good progress hous common cours deliv brexit may success far respit home polit infight enthusiast sceptic brexit rule parti reduc prospect disorderli departur bloc at summit keen show britain activ member bloc commit stay erasmu univers programm end take part discuss bloc plan closer defenc cooper over dinner leader also discuss respons migrat crisi africa middl east linger deep divis share load they confirm rollov sanction russia ukrain crisi reaffirm opposit us presid donald trump move recognis jerusalem capit israel,worldnews,14-Dec-17,0
What a difference a year makes - EU warms to Britain's May,what differ year make a year ago prime minist theresa may pictur stand alon eu summit nervous play sleev leader embrac chat around imag sum isol britain vote brexit on thursday leader state pois agre move brexit talk forward decis phase discuss futur tie yearold greet show support includ applaus round congratul summit dinner she need it second phase talk like even difficult first could widen divis govern parti countri britain becom brexit may also face embolden parliament home rebel conserv parti join forc opposit lawmak vote govern brexit blueprint someth may tri repeat next week may plan write britain departur date law but chang atmospher brussel improv chanc friendlier divorc reduc possibl britain crash without deal it may chang born necess a weaken may could forc offic eu want see new possibl hardlin negoti across tabl half way talk she best got she got said senior eu offici compar posit brexit minist david davi whose comment initi deal statement intent rather legal pact annoy mani bloc for mani conserv too may seen lead contend secur britain exit march i think prime minist certainli far away best place that said british lawmak brexit support david jone move posit brexit minist earlier year she done well connect first stage agreement odd what actual achiev accept part european union leav leav without caus problem intern accidentpron may appoint prime minist shortli britain vote month ago leav eu commit honor decis unravel four decad eu membership but path smooth after lose parti major june elect may almost unnatur accidentpron an attempt reassert author collaps cough fit speech conserv parti confer octob last week choreograph attempt seal deal move second phase talk eu fell apart northern irish alli refus sign it that european commiss presid jeanclaud juncker hail may tough negoti one defend point view britain energi know an embarrass defeat parliament wednesday underlin weak reli support small northern irish parti pass legisl but two fail attempt within parti oust her may prove mani detractor wrong push brexit sap govern abil pursu polici defin time power the govern defeat amend make exit complic incent eu negoti good deal said conserv lawmak john baron howev process hardli ever go smooth remain cours honor referendum result so now carri divid parti her but agreement move phase two conserv describ compromis shown fray edg coalit the key keep cabinet minist board it fudg get next stage leav cabinet member reassur get brexit want said senior conserv sourc that may mean keep possibl open britain move away eu regul leav could worri eu offici the british peopl control environ minist michael gove said last week if british peopl dislik arrang negoti eu agreement allow futur govern diverg,worldnews,14-Dec-17,0
"Two dead, several wounded in stabbing in southern Dutch city Maastricht: police",at least two peopl kill sever other wound stab southern dutch citi maastricht thursday even polic said the polic said statement two stab incid hundr meter yard residenti neighborhood northern maastricht border germani belgium,worldnews,14-Dec-17,0
"U.N. calls Syria talks a 'big missed opportunity', seeks new ideas",a round syria peac talk end thursday big miss opportun may talk next month idea found encourag presid bashar alassad govern engag un mediat staffan de mistura said he said neither side actual sabotag latest talk refus attend laid blame failur round feet govern side de mistura voic milder disappoint syrian opposit arriv geneva rule futur role assad but said tough public stanc temper matur posit closeddoor discuss the goal bring real negoti de mistura told news confer let frank we achiev achiev negoti in word negoti realiti take place i would conclud say it wa big miss opportun a golden opportun end year fact clear indic mani side militari oper come close ad de mistura said leav geneva consult new york un secretari gener antonio guterr follow meet un secur council tuesday i probabl need come new idea paramet move talk forward particularli constitut elect said ad plan new round geneva talk januari depend outcom civil war ravag syria six year chief opposit negoti nasr hariri said intern commun need persuad govern negoti bashar alja afari come tabl warn talk great danger the intern commun need find new approach otherwis stalem continu unfortun expens syrian said one european diplomat said talk charad govern behavior although regim present here done i would go further kind disengag shown extraordinari contempt said i understand larg amount time spent negoti person admin matter expens rather substanc talk as left talk ja afari accus opposit back western countri saudi arabia sabotag round ja afari said damascu want talk fail opposit put precondit last month conclud confer known riyadh declar assad role syria polit transit de mistura said damascu govern want insist opposit withdraw statement that possibl logic approach sound like precondit the govern engag discuss about terror the truth one singl subject accept except one,worldnews,14-Dec-17,0
Britain First leader whom Trump re-tweeted arrested again in Belfast,a leader british farright group whose antiislam post retweet us presid donald trump caus outrag britain arrest northern ireland thursday minut bail separ incid jayda fransen deputi leader fring antiimmigr britain first group appear court belfast face charg use threaten abus insult word speech ralli citi august she remand continu bail januari condit go within meter ralli demonstr case finish as left court fransen arrest charg break law separ incid wednesday near one peac wall separ cathol protest neighborhood polic said polic declin give detail incid britain first leader paul gold also arrest accompani fransen courthous later charg connect august incid trump share fransen antimuslim video post twitter provok outrag britain last month draw sharp rebuk prime minist theresa may strain relat two close alli an attempt polic restrict fransen use social media twitter facebook reject judg thursday fransen fine last month found guilti court england religi aggrav harass shout abus muslim woman wear hijab her lawyer told belfast magistr court thursday would plead guilti charg face relat august ralli gold former senior figur farright british nation parti found britain first the group describ patriot polit parti street movement critic denounc racist organ,worldnews,14-Dec-17,0
"Opposition official, others charged with plotting against Rwandan government",a rwandan opposit offici eight other charg wednesday form arm group seek overthrow govern indict could see jail life bonifac twagirimana vice presid fdu inkingi movement deni charg kigali court the parti leader victoir ingabir alreadi jail convict conspir form arm group charg the prosecutor said defend join p describ umbrella group five organ includ fdu inkingi oper outsid countri the central african nation wide prais speed econom growth overal recoveri genocid kill peopl but right group accus fuel conflict back arm group neighbor democrat republ congo presid paul kagam also face mount critic activist say widespread abus muzzl independ media suppress polit opposit accus dismiss onli one defend plead guilti charg papia ndayishimiy said plan join group offer help he join other deni plot govern they could jail year convict form arm group life found guilti plan overthrow govern earli month polic arrest dian shima rwigara lead critic kagam charg forgeri tax evas,worldnews,20-Sep-17,0
"EU's Tusk, UK's May to talk Brexit next Tuesday",european council presid donald tusk said would meet british prime minist theresa may london next tuesday discuss brexit day due make keynot speech vision futur tie eu he made comment tweet meet may unit nation gener assembl the london meet pair come sensit time speech florenc friday eu head state dinner sept tallinn estonia the financi time said may top eu advis told counterpart sever european would florenc offer fill postbrexit eu budget hole least billion euro the newspap cite offici brief discuss senior eu offici given talk offer short shrift they dismiss suggest float british media offer billion euro payabl transit period brexit would accept brussel it could be said altern billion eu execut estim may payabl brexit march brussel negoti acknowledg privat may help british govern sell settlement domest voter london meld exit payment transit payment reduc headlin divorc bill eu offici told reuter would discuss brexit tallinn dinner may might take opportun brief bloc leader posit talk brexit made littl progress deepen rift may parti set florenc speech chanc put negoti back track reassert author while tusk coordin eu leader brexit michel barnier negoti british made clear london point contact brexit talk barnier negoti direct frustrat british counterpart want move talk divorc issu eu departur bill irish border futur relat barnier first want see progress term britain exit,worldnews,19-Sep-17,0
"Trump says he has made decision on Iran deal, declines to say what it is",us presid donald trump said wednesday made decis whether pull unit state nuclear deal iran world power declin say wa trump ask report said i decid if trump certifi octob iran compli agreement us congress day decid whether reimpos sanction waiv pact,worldnews,20-Sep-17,0
Italy's center-right in search of a leader as election nears,former prime minist silvio berlusconi return frontlin italian polit weekend stake claim lead resurg centerright nation elect expect earli next year at exactli moment berlusconi outspoken alli matteo salvini address northern leagu parti lay marker becom next prime minist salvini premier read sign stuck lectern in realiti neither man look like head next govern pull elect victori possibl altern candid alreadi emerg there appar power struggl go berlusconi salvini get hand they know violent clash would suicid voter said piero ignazi polit professor bologna univers the truth men remain head respect parti next prime minist said thi would open way consensu candid would bridg huge diverg three main rightist parti fierc antieu agenda put forward northern leagu brother itali proeuropean vision embrac berlusconi sunday latest opinion poll show trio longstand alli pull ahead poll predict win combin percent vote antimigr northern leagu ahead berlusconi forza italia percent by contrast antiestablish star movement rule centerleft democrat parti pd seen around percent apiec the star rule coalit allianc centerleft pool vote shrink variou leftist parti engag feroci infight under current elector system parti bloc look like win enough seat govern alon howev polit analyst say wind fill centerright sail year advers condit give preelect momentum berlusconi ignomini resign power sovereign debt crisi mire sex scandal legal woe subsequ expel senat ban run offic due tax fraud convict open heart surgeri last year left analyst write polit obituari but first time media tycoon bounc back appeal european court human right overturn ban seek elect a hear schedul novemb verdict unlik come sever month mean almost certainli abl stand next nation ballot due may wide expect held march despit age berlusconi would love prime minist again it would last hurrah but realist speak happen said forza italia offici declin name sensit issu significantli berlusconi made polit comeback speech event organ forza italia stalwart antonio tajani presid european parliament parti sourc said tajani pole posit berlusconi surrog while berlusconi name abroad evok memori bunga bunga sex parti wisecrack tajani much less color charact whose proeuropean instinct would make reassur figur intern market those instinct would pose problem berlusconi hardlin alli regularli denounc european union call itali quit euro the leader centerright need chosen clear process perhap primari giorgia meloni head brother itali told sky italia televis sunday i imagin whatev grassroot method decid tajani win out said brother itali small nationalist parti antimigr antieuro it tri differenti leagu say focus whole countri wealthi north buoy leagu strong poll number salvini say leader parti win vote next year automat prime ministeri candid but berlusconi fourtim premier rule hand baton power salvini embrac europ farright endors franc nation front we creat centerright itali alway leader lay fulfil program berlusconi said sunday the two men spoken month say hurri discuss strategi polit analyst specul probusi forza italia might find easier creat govern nation uniti former prime minist matteo renzi pd parti rather populist northern leagu forza italia loyalist reject notion we rule northern leagu year nation govern rule region go well said forza italia lawmak deborah bergamini one region coalit liguria head forza italia giovanni toti he attend forza italia northern leagu ralli weekend due take part brother itali meet weekend toti care build bridg three parti would natur choic head nation coalit bologna univers ignazi said,worldnews,20-Sep-17,0
U.S. must suffer 'painful responses' from Iran after Trump speech: Guards chief,the head iran revolutionari guard said wednesday unit state experi pain respons follow presid donald trump harsh critic tehran unit nation in first speech un gener assembl tuesday trump call iran corrupt dictatorship accus support terror destabil middl east he also hint might recertifi nuclear deal tehran come midoct deadlin take definit stand trump begin path said gener mohammad ali jafari accord sepah news news site revolutionari guard what strateg import america wit pain respons action behavior decis iran take come month in recent month tension ramp iran unit state gulf side accus provoc maneuv militari vessel jafari urg iranian presid hassan rouhani deliv definit respons trump speech unit nation wednesday with success exhaust defeat american face region iran natur nervou system coher thought fallen apart sepah news quot jafari say in tuesday speech trump call nuclear deal negoti iran six world power back predecessor barack obama embarrass under deal iran agre curb atom program return eas econom sanction,worldnews,20-Sep-17,0
"Russia rebukes Trump over Iran, North Korea, accuses U.S. of missile treaty breach",russia extrem concern us presid donald trump comment question iran nuclear deal suspect washington may violat landmark arm control treati foreign minist sergei lavrov said lavrov comment made russian report unit nation new york publish ministri wednesday illustr deepli moscow washington odd array issu suggest attempt improv alreadi batter relat face uphil struggl address unit nation gener assembl tuesday trump said iran pact six world power curb nuclear program return loosen econom sanction embarrass unit state washington could abid agreement provid cover eventu construct nuclear program trump said lavrov whose countri signatori deal said russia strongli disagre stanc it extrem worri said we defend document consensu met relief entir intern commun genuin strengthen region intern secur trump threat un appear total destroy north korea defend alli also went badli russia share border north korea believ negoti diplomaci way resolv crisi pyongyang missil program if simpli condemn threaten go antagon countri want exert influenc said lavrov refer trump comment he save harshest critic howev said possibl violat unit state landmark arm control treati ban russian american intermediaterang missil land a senior trump administr offici accus russia earlier year violat pact intermediaterang nuclear forc inf treati someth moscow deni but lavrov said look like washington midst trillion year modern age ballist missil submarin bomber landbas missil breach treati we suspicion least three front american creat weapon system violat could violat treati oblig said lavrov said moscow relay concern unit state lavrov met us secretari state rex tillerson twice new york week,worldnews,20-Sep-17,0
Leaders of far-right UK group charged with religiously aggravated harassment,the leader farright british polit group britain first charg caus religi aggrav harass wednesday polic said paul gold deputi jayda fransen southeast london arrest may distribut leaflet kent east london onlin video post court trial the case involv number muslim men later convict rape both bail appear medway magistr kent oct the fring group oppos mass immigr say racist loyalist movement stage number demonstr around britain usual attract hundr protest,worldnews,20-Sep-17,0
"Raqqa campaign in final stages, SDF says",the usback syrian democrat forc sdf said wednesday campaign captur raqqa islam state is final stage fighter seiz percent citi in fight separ oper wage syrian armi alli islam state collaps along west bank euphrat downstream raqqa syrian observatori human right said wednesday is lost swath territori syria year attack north sdf west syrian armi push back across desert last stronghold euphrat valley the sdf allianc kurdish arab militia launch offens jihadist group raqqa citi june back usl air strike special forc ground the citi serv islam state de facto capit syria in statement wednesday sdf said open new front is northern edg raqqa thi featur final stage euphrat wrath campaign near end we say percent citi raqqa liber statement said an sdf media offici said main obstacl face allianc raqqa avoid civilian casualti high concentr mine he estim is fighter remain citi the syrian observatori human right said wednesday islam state control percent citi remain milit nearli run food munit in deir alzor provinc eastern syria islam state battl two separ offens launch sdf one side syrian armi alli other the syrian armi back russian syrian war plane captur km mile west bank euphrat month reach raqqa provinci border wednesday observatori report syrian troop also cross eastern side river monday the sdf advanc eastern bank river the converg two rival offens increas tension deir alzor the usback militia monday warn syrian armi advanc eastern riverbank on tuesday russia defenc ministri said euphrat risen soon syrian armi began cross it the way could happen upstream dam held usback opposit open said a fire major ga field known conoco rage tuesday night wednesday observatori said syrian state media report armi advanc toward it islam state fled area observatori ad the hardlin milit lost main stronghold iraq citi mosul juli westernback iraqi forc,worldnews,20-Sep-17,0
UK police arrest three in Wales over London train bomb attack,british polic arrest three men south wale last week bomb busi commut train west london mean five peopl question detect attack injur peopl a yearold man arrest tuesday even newport two other age detain anoth address welsh town earli hour wednesday london polic said thi continu fastmov investig a signific amount activ taken place sinc attack friday said command dean haydon head london polic counter terror command we five men custodi search continu four address detect carri extens inquiri determin full fact behind attack the homemad bomb went friday morn rush hour pack train parson green underground station engulf carriag flame although appear devic fulli explod in aftermath author rais britain threat level highest rank critic mean attack consid immin lower arrest two men saturday an yearold arrest departur loung port dover saturday anoth suspect detain hour later west london suburb hounslow both said local media link properti sunburyontham town outsid london polic carri major search the hous belong coupl foster hundr children includ refuge the leader local author quot say yearold iraqi come britain orphan islam state milit said respons attack although british us offici cast doubt claim say evid recogn milit group order organ bomb friday bomb fifth major attack regard author terrorist incid britain year claim live peopl,worldnews,19-Sep-17,0
 Donald Trump Sends Out Embarrassing New Year’s Eve Message; This is Disturbing,donald trump wish american happi new year leav that instead give shout enemi hater dishonest fake news media the former realiti show star one job it as countri rapidli grow stronger smarter i want wish friend support enemi hater even dishonest fake news media happi healthi new year presid angri pant tweet great year america as countri rapidli grow stronger smarter i want wish friend support enemi hater even dishonest fake news media happi healthi new year great year america donald j trump s tweet went welll expectwhat kind presid send new year greet like despic petti infantil gibberish onli trump hi lack decenc even allow rise gutter long enough wish american citizen happi new year bishop talbert swan s calvin stowel decemb your impeach would make great year america i also accept regain control congress miranda yaver self talk when includ mani peopl hate wonder whi hate me alan sandov se word hater new year wish marlen st say happi new year koren pollitt s trump new year eve tweet happi new year all includ mani enemi fought lost badli know do love donald j trump s noth new trump he yearstrump direct messag enemi hater new year s easter thanksgiv anniversari daniel dale s holiday tweet clearli presidentialhow long work hallmark becom presid steven goodin s alway like differ last year filter break down roy schulz se term hater wendi stle decemb he fuck year old who know s hole think would chang got power wrong yearold men chang year olderphoto andrew imag,News,31-Dec-17,1
 Drunk Bragging Trump Staffer Started Russian Collusion Investigation,hous intellig committe chairman devin nune go bad day he assumpt like mani us christoph steeledossi prompt russia investig lash depart justic fbi order protect trump as happen dossier start investig accord document obtain new york timesform trump campaign advis georg papadopoulo drunk wine bar reveal knowledg russian opposit research hillari clintonon top that papadopoulo covfef boy trump administr alleg he much larger role none damn drunken fool wine bar coffe boy help arrang new york meet trump presid abdel fattah elsisi egypt two month elect it known former aid set meet world leader trump team trump ran mere coffe boyin may papadopoulo reveal australian diplomat alexand downer russian offici shop around possibl dirt thendemocrat presidenti nomine hillari clinton exactli much mr papadopoulo said night kensington wine room australian alexand downer unclear report state but two month later leak democrat email began appear onlin australian offici pass inform mr papadopoulo american counterpart accord four current former american foreign offici direct knowledg australian role papadopoulo plead guilti lie fbi cooper wit special counsel robert mueller teamthi presid it badli script realiti tv showphoto win imag,News,31-Dec-17,1
