title,text,subject,date,isfake
"HILLARY CLINTON: We All Know She’s Deceitful And Dishonest, But I Bet You Didn’t Know This…",she uneth dishonest lawyer she conspir violat constitut rule hous rule committe rule confidenti i decid reprint piec work i nearli five year ago seem relev today given hillari clinton perform benghazi hear back run presid i interview two erstwhil staff member hous judiciari committe involv aterg investig hillari lowlevel staffer there i interview one democrat staffer one republican staffer wrote two piec base told hillari conduct timei publish piec back north star writer group syndic i ran time thi wide read piec ever nswg nswg never gain highprofil statu major syndic piec still reach mani peopl i thought deserv to today given much broader reach caintv yet anoth incid hillari arrog deal congression committe i think deserv anoth air for purpos simplic i combin two piec one long one if interest understand true charact hillari clinton worth time read ita hillari clinton came increas scrutini stori face sniper fire bosnia one question aros whether engag pattern lyingth nowretir gener counsel chief staff hous judiciari committe supervis hillari work waterg investig say hillari histori lie uneth behavior goe back farther goe much deeper anyon realizesjerri zeifman lifelong democrat supervis work yearold hillari rodham committe hillari got job work investig behest former law professor burk marshal also sen ted kennedi chief counsel chappaquiddick affair when investig over zeifman fire hillari committe staff refus give letter recommend one three peopl earn dubiou distinct zeifman year careerwhi becaus liar zeifman said interview last week she uneth dishonest lawyer she conspir violat constitut rule hous rule committe rule confidenti how could yearold hous staff member that she herself zeifman said one sever individu includ marshal special counsel john doar senior associ special counsel and futur clinton white hous counsel bernard nussbaum engag seemingli implaus scheme deni richard nixon right counsel investigatiowhi would want that becaus accord zeifman fear put waterg breakin mastermind e howard hunt stand crossexamin counsel presid hunt zeifman said good nefari activ kennedi administr would made waterg look like day beach includ kennedi purport complic attempt assassin fidel castroth action hillari cohort went directli judgment top democrat includ thenhous major leader tip o neill nixon clearli right counsel zeifman say hillari along marshal nussbaum doar determin gain enough vote judiciari committe chang hous rule deni counsel nixon and order pull off zeifman say hillari wrote fraudul legal brief confisc public document hide deceptionth brief involv preced represent counsel impeach proceed when hillari endeavor write legal brief argu right represent counsel impeach proceed zeifman say told hillari case suprem court justic william o dougla face impeach attempt as soon impeach resolut introduc thenhous minor leader gerald ford refer hous judiciari committe first thing dougla hire lawyer zeifman saidth judiciari committe allow dougla keep counsel thu establish preced zeifman say told hillari document establish fact judiciari committe public file so hillari do hillari remov dougla file offic locat time secur inaccess public zeifman said hillari proceed write legal brief argu preced right represent counsel impeach proceed dougla case never occurredth brief fraudul ridicul zeifman believ hillari would disbar submit judgezeifman say hillari marshal nussbaum doar succeed member hous judiciari committe would also deni right crossexamin wit deni opportun even particip draft articl impeach nixonof cours nixon resign render entir issu moot end hillari career judiciari committe staff undistinguish manner zeifman say urg top committe member keep diari everyth happen he so still diari anyon want check verac stori certainli could known diari entri young lawyer name hillari rodham would interest anyon year laterbut show pattern lie deceit fabric uneth behavior establish long ago long bosnia lie inde even cattl futur travelg whitewat woman still ask us make presid unit statesfranklin polk serv time chief republican counsel committe confirm mani detail two interview grant past friday although analysi event alway ident zeifman s polk specif confirm hillari wrote memo question confirm hillari ignor dougla case he said confirm dispel part hillari take dougla filesto polk hillari memo dishonest sens tri pretend dougla preced exist but unlik zeifman polk consid memo dishonest way stupid sinist hillari mention the dougla case tri argu whether chang polici instead ignor take preced opinion polk saidpolk recal attempt deni counsel nixon upset great mani member committe includ republican mani democrat well the argument sort broke like firestorm committe i rememb congressman don edward upset polk said he chairman subcommitte constitut right but truth impeach preced clear let put way in old day begin countri s earli s preced target accus right counsel that polk believ hillari approach write memorandum foolish he say could argu dougla case isol exampl histor preced could applybut zeifman say memo remov dougla file part effort hillari doar nussbaum marshal pursu agenda investigationaft first column reader wrote claim zeifman motiv jealousi appoint chief counsel investig titl go doar insteadzeifman account support appoint doar he zeifman a want public notorieti would come highprofil role b much prosecutori experi when start problem doar alli zeifman other includ hous major leader tip o neill democrat committe member jack brook texa began perceiv doar group act outsid direct knowledg committe chairman peter rodinoo neill die brook still live i tri unsuccess reach him i still like tothi culmin project research past presidenti abus power committe member felt crucial aid decis would make decid handl nixon alleg offensesaccord zeifman document doar direct hillari work group yale law professor project but report gener never given committe zeifman believ reason report littl whitewash kennedi year part burk marshall agenda avoid revel waterg investig would embarrass kennedysth fact report kept wrap upset republican committe member charl wiggin california wrote memo colleagu committe read partwithin past day disturb inform come attent it request fact concern matter investig report made full committe concern us allearli last spring becam obviou committe consid presidenti abus power possibl ground impeach i rais question full committe research undertaken furnish standard test alleg abus conduct richard nixona i recal sever member join request i recal well repeat request time time cours investig the staff i recal noncommitt certain staff studi made avail member time usewiggin believ report purpos hidden committe member chairman rodino deni thi said reason hillari report given committe member contain valu it worth note cours staff member made judgment john doarin fourpag repli wiggin rodino wrote parthillari rodham impeach inquiri staff coordin work after staff receiv report review ms rodham briefli mr labovitz mr sack doar the staff think manuscript use present form in letter suggest member staff may intent suppress report cours investig that casea matter fact mr doar concern highlight project might prejudic case presid nixon the fact staff think materi usabl committe exist form time modifi would practic util member committe i inform agre judgmentmr labovitz way john labovitz anoth member democrat staff i spoke labovitz past friday well fan jerri zeifman if accord zeifman inaccur perspect labovitz said he base statement recollect zeifman actual work impeach inquiri staff although contradict zeifman polk welllabovitz said knowledg hillari taken file defend norighttocounsel memo ground that assign write memo argu point view mere follow ordersbut zeifman polk point out mean ignor background awar wors zeifman alleg confisc document disprov argumental told polk recal action hillari doar nussbaum amateurish anyth els of cours republican went nut polk said but democrat liber democrat it like guy doar compani tri manag member congress like who charg here if want convict presid want give right possibl if go give trial say my right deni stupid effort peopl polit tone deaf so big deal peopl proceed committe question it and jerri zeifman went nut right so but reaction much underhand stupid polk recal zeifman share time believ hillari primari role report back burk marshal time investig take turn like kennedi jerri use give chapter vers hillari mole committe work thing go polk said and feed inform back burk marshal who least accord jerri talk kennedi and someth track view kennedi burk marshal would call john doar someth would reconsider talk about jerri use tell hillari primari function zeifman say anoth staff member get hillari phone record show call burk marshal least day often sever time daya final note thi i wrote first column subject becaus aftermath hillari caught bosnia fib i came contact jerri zeifman found stori compel zeifman tri tell stori mani year mainstream media ignor him i thought deserv air demonstr earli career hillari began engag selfserv disingenu conductdisingenu argu posit vanish document sell member parti advanc person agenda classic hillari neither first column subject one design show hillari dishonest i realli think disput rather design show way long time fact worth consid anyon contempl vote presid unit statesbi way someth els start long time ago she would go around say i date person day presid polk said it like babe ruth call and comment made i watch bill clinton polit effort governor arkansa i never count made forecast bill knew want long time ago clearli hillari tactic tri achiev establish even earli daysvot wiselyvia patriot net daili,Government News,15-Apr-15,1
BREAKING: VIDEO OF YOUNG OBAMA EMERGES Discussing Mentor Frank Marshall Davis’ Advice About Growing Up In A White Racist World,who need famili neighborhood mentor teach valu racism commun hate americain book dream my father barack obama never discuss ident mysteri frank given import advic grow black describ white racist world we learn frank frank marshal davi member communist parti subject page fbi file still major media never ask obama import relationship grow year hawaiinow extraordinari develop video obama explicitli openli identifi frank frank marshal davi suddenli surfac internet the footag said record septemb program origin air channel cambridg municip televis episod show the author seri it clear mani saw program air for reason from vault barack obama present recent post youtub in video obama introduc harvard law school student presid harvard law review he discuss frank frank marshal davi videoin remark obama never identifi davi communist even leftist but remark reflect signific influenc davi young life grow hawaii obama talk davi school subject race relat the term impli teacherstud relationship two had confirm report back davi function obama mentor it import understand obama say here get readi read directli book dream my father obama talk passag end convers close friend matern grandfath close friend gramp black man kansa name frank actual time fairli wellknown poet name frank marshal davi move hawaii live there i discuss kind frustrat i have sort school i get use frustrat davi inde black poet hi work includ attack christian one davi poem refer christ irrever nigger davi atheisthowev davi better known communist propagandist whose work communist parti hawaii earn surveil fbi placement secur index davi also pornograph engag bizarr sexual practic even pedophilianeedless say obama willing identifi frank davi audienc rais question frank identifi full name frank marshal davi book itself obama made refer frank time throughout book paul kengor note obama audio version dream my father omit everi refer frank book those omiss clearli design keep peopl ask question frank sinc obama consid run presidencytoday discov film obama identifi frank davi confirm obviou it make lot differ polit sinc obama serv second term but could made differ seven year ago identifi frank davi obama campaign first term officeth clip obama talk davi cambridg present import reason howeverbi admiss obama preoccupi feel thought race relat he saw angri young man whose father absent life he said without father figur around might guid steer anger that signific clear passag read davi becam father figur davi inde pick white grandfath role model father figur young barack obamain passag read back obama discuss invit white friend black parti see squirm they tri tap foot beat extraordinarili friendli said they tri fit uncomfort tell obama want leav obama conclud what i put everi day life someth find objection even put day thi like revel obama world white racism all say trigger someth head comprehend new map world he get sens anger betray societi even famili rais white grandfath gramp white grandmoth toot thi lead seek advic frank frank marshal davi sort school i get use frustrat obama saysth passag read book cambridg audienc includ discuss white grandmoth accost black panhandl davi told obama grandmoth right scare she understand black peopl reason hate in word davi encourag obama pursu racial harmoni reconcili he told obama black reason right weasel zipper,Government News,14-Apr-15,1
Ron Paul: ‘I Can’t Support Trump if He’s GOP Pick’ and ‘Neocons Will Love Hillary’,david sherfinski washington timesform texa rep ron paul said friday support gop presidenti frontrunn donald trump mr trump win parti nomin say mr trump view scope execut author could surpass presid obama no i that mr paul said fox busi network ask would support mr trump billionair businessman win gop nomin he the opposit libertarian mr paul threetim presidenti candid said foreign polici mr trump probabl much differ former secretari state hillari rodham clinton democrat frontrunn i think diehard neoconserv would extrem unhappi hillari mr paul said trump go effici at use execut order said he say way is know obama pretti arrog if it the congress i write order continu stori washington timesread more trump news at st centuri wire file,Middle-east,20-Mar-16,1
ART OF WAR: What’s Behind Russia’s ‘Ides of March’ Military Drawdown in Syria?,appear weak strong strong weak sun tzu the art warst centuri wire ask what behind russia decis drawdown militari support syria make a deal putin make strateg deal geneva iii talk photo link theaustralianthi week russia scale back militari campaign isi target syria systemat direct month success airstrik terror group within embattl nationrussia partial departur tenuou ceasefir syria symbol one haunt ide march histor signific also mark fiveyear anniversari syria socal arab spring when campaign toppl syrian leadership first began told legitim grassroot upris sweep across north africa middl east the mainstream media gleefulli exult prais organ movement chang wide hail arab spring while spring sold public larg protest movement proven well orchestr social engin polit upris use gain foothold syria open door western interventionback februari wire report isi jihadist fact flee syria follow destruct oper base within countri colonel steve warren usl coalit said terror group leadership shift base oper syria iraq libya face immens bombard we believ failur due sever factor first foremost i believ presenc devast coalit air power the whitehous ad isi also seek send jihadist recruit libya instead syria iraq while us leadership mention devast coalit air power led syria good fortun fail directli discuss russia larg role silenc isi known milit fight group some still refer washington moder rebel air campaign ownto anyon pay attent battleground syria messag clear washington fulli acknowledg eventu erad mani isi fighter lead us polici maker rethink regim chang strategyrec wire discuss cynic len view ceasefir deal syria note peac agreement could well turn polit ploy craft pentagon war maker look rearm milit region thi latest diplomat develop certainli appear posit surfac week declar syrian ceasefir threeway agreement washington russia syrian govern and begrudgingli west region stakehold look increasingli like may latest attempt buy time washington turkey saudi arabia rearm replenish variou milit fight group current lay wast syria continu see west failur follow loss proxi milit broker deal perhap polit play moment the washingtonl axi gradual lost proxycontrol number key terrorist stronghold northern syria name aleppo thu unabl dictat crucial fact ground requir dictat intern media polit narr unabl craft packag narr west dubiou coalit complet unabl sell escal militari violenc syria from propaganda perspect latest militari move russia prompt polici maker western thinktank character strateg decis sign rift putin assad see sputnik news articl below time militari drawdown everyth upcom peac talk negoti genevamor sputnik art of war syria struggl appear move battlefield boardroom photo illustr shawn helton wireandrew korybkosputnik newsth western mideast mainstream media frenziedli spin russia plan drawdown syria militari defeat betray key alli exactli betray whom presid putin announc russia begin draw militari forc syria march popularli known ide march infam day emperor juliu caesar stab death allieswhil may chosen innoc enough date rich symbol quit fit describ chang dynam present play mideaston peculiar day year thing typic may initi seem be popularli portray defeat betray anyth but one prematur celebr iron forc concern mostnearli two millennia ide march fate enshrin histori longer roman emperor betray alli turkish saudi one backstab usth drawdownpresid putin assad coordin decis decreas russian troop presenc syria agre antiterrorist oper complet state aim combat terror restor secur stabil mani region syria in particular russian defens minist sergei shoigu proclaim countri carri flight contribut syrian troop liber town squar kilometr territori the reader encourag consult the saker latest articl interest detail analysi everyth russia accomplish thu far present piec move describ intent behind drawdown conting measur place defend syria largescal aggress itfrom battlefield boardroomrussia announc time coincid resumpt geneva iii talk clearli carri symbol messag moscow doubl diplomat commit resolv war syriaa dejur partit absolut tabl prohibit unsc re creep fear among mani defacto one could occur feder ever implementedit perhap reason syrian govern peopl current favor approach curiou reader wonder exactli could bad feder author welcom read earlier publish research topic avail russia nation institut research global securityaft five half month oper russia antiterrorist air oper succeed herculean task bring war syria final logic phase protract negoti process recommencedth conflict thu shift battlefield boardroom lament event foreign actor influenc polit surrog sabotag ongo talk reiniti largescal hostil russia backup measur sleev make sure syria left unsecuredmor sputnik news read more syrian news at st centuri wire st centuri wire syria file,Middle-east,18-Mar-16,1
U.S. Senate Passes Bipartisan Bill Claims to Facilitate ‘Better Public Access’ to Gov’t Records,st centuri wire saysw believ when even allow see redact mari clare jalonick govwashington the senat tuesday back legisl make easier american obtain govern recordsth bipartisan bill pass voic vote would requir feder agenc consid releas govern inform presumpt open oppos presumpt inform secretth legisl aim reduc amount exempt govern use withhold inform would creat singl portal individu submit freedom inform act foia request current foia request handl separ agenc rule submit request today vote send clear messag american peopl fundament right know govern do cornyn said we cannot leav next presid decid open govern be leahi said we hold presid administr account highest standard republican congress complain obama administr fulli transpar share record lawmak public white hous critic congress exempt requir foia appli congressth hous pass similar bill januari becaus two bill ident hous act send legisl presid barack obama maryland rep rep elijah cum top democrat hous committe oversight govern reform urg speaker paul ryan rwi promptli pass senat bill say foia reform long overdu continu stori all govread more foia news at st centuri wire foia file,Middle-east,18-Mar-16,1
"OREGON: Feds Cover-up Foul Play in Finicum Death, Feds’ Shell Casings ‘Have Gone Missing’",st centuri wire say as turn out right ambush right coverup after thi quisl the oregonian still tri tartup fbi osp debacl call traffic stop while forc admit foul play infal govern part mainstream media gatekeep still tri paint incid traffic stop beyond jokeget readi anoth governmentissu magic bullet fairi tale protect hire gunshow long call assassin new find law enforc offici suggest fbi agent scene fatal shoot bundyaffili protest lavoy finicum jun feloni stop might fire two shot report agent scene might dispos bullet case cover upaccord the oregonian investig believ shot fire approxim moment lavoy finicum exit truck hand up prior appear reach jacket shot two oregon state polic trooper the aboveembed slowmot video show moment investig believ shot fireddeschut counti sheriff shane nelson malheur counti district attorney dan norri investig incid conclud oregon state polic offic justifi shoot finicum also announc believ fbi agent took two unreport shot lie it the us depart justic subsequ launch crimin investig conduct fbi agent sceneth oregonian le zaitz wrote a state trooper later describ investig see two rifl case area fbi agent post detect task collect evid find case polic report indic he ad fbi aerial surveil video show detect could get there fbi agent search area flashlight huddl accord law enforc sourc seen video the group broke one agent appear bend twice pick someth near two shot like taken polic report indic detect show collect evid around minut moment surveil video fbi agent appear pick item groundal fbi agent scene day claim take shot a state trooper said fire three shot truck speed toward polic two finicum reach jacket exit vehicl polic inventori record show trooper miss five round incid appar confirm storya fourth bullet hole truck came differ angl trajectori suggest fbi agent fire shot investig believ second shot miss finicum strike truck also fire fbi agent continu stori truth in mediaread more oregon standoff news st centuri wire oregon file,Middle-east,17-Mar-16,1
"BOILER ROOM – EP #48 – Agenda 2030 and Beyond with Branko Malić, Patrick Henningsen & Mike Robinson",tune altern current radio network acr anoth live broadcast the boiler room start pm pst pm est everi wednesday join us uncensor uninterrupt talk radio custommad barfli philosoph misguid moralist masochist street corner evangelist mediamaniac savant polit anim otherwis lovabl rascalsjoin acr host hesher spore along branko mali kali tribun mike robinson uk column patrick henningsen stcenturywir in broadcast listen hear us go around boiler room encroach un agenda european migrant crisi us polit climat varieti topic special edit the boiler room if want particip bring someth interest throw boiler join us altern current radio chat roomboil room is not a polict correct zone listen to the show in the player below enjoy refer link,Middle-east,16-Mar-16,1
