title,text,subject,date,isfake
 Sheriff David Clarke Becomes An Internet Joke For Threatening To Poke People ‘In The Eye’,on friday reveal former milwauke sheriff david clark consid homeland secur secretari donald trump administr email scandal ownin januari brief runin plane clark fellow passeng dan black later detain polic reason whatsoev except mayb feel hurt clark messag polic stop black deplan now search warrant execut fbi see exchangesclark call fake news even though copi search warrant internet i unintimid lib media attempt smear discredit fake news report design silenc me former sheriff tweet i continu poke eye sharp stick bitch slap scum bag til get it i attack better peopl maga i unintimid lib media attempt smear discredit fake news report design silenc me i continu poke eye sharp stick bitch slap scum bag til get it i attack better peopl maga david a clark jr stop therebreak news when lie lib media make fake news smear me antidot go right them punch nose make them tast their own blood noth get bulli like lie lib media s attent better give tast blood neverbackdown david a clark jr s local newspap search warrant fake chose file charg time mean t especi continu lie month decis charg clark email search warrant file keithleblanc st hope rest villag peopl implic kirk ketchum s french fri alt immigr sci decemb pendulum swinger s stand someon made fun hat chri jackson scjackson decemb is me master pshop hat i seem never tire of i think steeli resolv one visibl eye chri mohney smohney decemb are indic finger mani peopl die jail i think finger short dipshit ike barinholtz so edgi buddi mr smh s break applebe aaron still relev badg circusrebel sdrew decemb make sure hydrat drink lot water it rumor prison deni water prison offici robert klinc s yearold black man die thirst clark milwauke counti jail cell april victim homicid we thought point out it repeat enoughphoto spencer imag,News,30-Dec-17,1
 Trump Is So Obsessed He Even Has Obama’s Name Coded Into His Website (IMAGES),on christma day donald trump announc would back work follow day golf fourth day row the former realiti show star blast former presid barack obama play golf trump track outpac number golf game predecessor playedupd tracker trump appear trump properti round golf includ today s at pace pass obama firstterm total juli next year philip bump s washington post report discov trump websit realli weird everyth administr bizarr af the code contain refer obama golf unlik obama work fix problem golf cours howev code done correctlyth websit donald trump spent sever day row golf cours code serv follow messag event intern server error christoph ingraham snippet code appear page footer say paid rnc christoph ingraham s also as other note thread weird code clear would ever actual display know christoph ingraham s call out refer obama deletedupd the golf error messag remov trump gop websit they also fix javascript vs problem still clear messag would actual display sinc actual and presum page display differ messag christoph ingraham suggest someon either rnc trump admin sensit enough trump golf problem make issu go away quickli peopl notic you idea much i love see email exchang led us here christoph ingraham s fcked upth best part use assign oper mean bit code never get run if look line errorcod alway sux decemb trump coder code nobodi surpris tim peterson son decemb donald trump obsess obama name even code websit play golf againphoto joe imag,News,29-Dec-17,1
 Pope Francis Just Called Out Donald Trump During His Christmas Speech,pope franci use annual christma day messag rebuk donald trump without even mention name the pope deliv messag day member unit nation condemn trump move recogn jerusalem capit israel the pontiff pray monday peac coexist two state within mutual agre intern recogn border we see jesu children middl east continu suffer grow tension isra palestinian franci said on festiv day let us ask lord peac jerusalem holi land let us pray resum dialogu may prevail parti negoti solut final reach the pope went plead accept refuge forc home issu trump continu fight against franci use jesu place inn analog today wind war blow world outdat model develop continu produc human societ environment declin christma invit us focu sign child recogn face littl children especi whom like jesu place inn said jesu know well pain welcom hard place lay one head ad may heart close home bethlehem the pope said mari joseph immigr struggl find safe place stay bethlehem they leav peopl home land franci said thi comfort easi journey young coupl child at heart full hope expect child born yet step weigh uncertainti danger attend leav home behind so mani footstep hidden footstep joseph mari franci said sunday we see track entir famili forc set day we see track million person choos go away driven land leav behind dear one amen thatphoto christoph imag,News,25-Dec-17,1
 Racist Alabama Cops Brutalize Black Boy While He Is In Handcuffs (GRAPHIC IMAGES),the number case cop brutal kill peopl color seem see end now anoth case need share far wide an alabama woman name angela william share graphic photo son lie hospit bed beaten fractur face facebook it need share far wide unacceptableit unclear william son polic custodi sort alterc result arrest see photo realiz detail matter not cop suppos beat brutal custodi in post see ms william express hope cop bodi camera beat son i think know kind conveni malfunct explain away lack exist dash bodi camera footag clearli brutal beat hell could even describ attempt murder someth tell young man never same without ado troy alabama finest decid appropri treatment angela william sonno matter perceiv crime young man might be complet unaccept the cop need rot jail long long time wanna bet get paid vacat forc investig itself offic return duti posthastethi folk say black live matter no way hell would happen angela william son white pleas share far wide stay tune addict info updatesfeatur imag via david imag,News,25-Dec-17,1
" Fresh Off The Golf Course, Trump Lashes Out At FBI Deputy Director And James Comey",donald trump spent good portion day golf club mark th day done sinc take oath offic it must bad game that trump lash fbi deputi director andrew mccabe twitter follow report say mccabe plan retir month the report follow mccabe testimoni front congression committe week well mount critic republican regard russia probeso natur trump attack mccabe lie how fbi deputi director andrew mccabe man charg along leakin jame comey phoni hillari clinton investig includ illeg delet email given wife campaign clinton puppet investig trump tweetedhow fbi deputi director andrew mccabe man charg along leakin jame comey phoni hillari clinton investig includ illeg delet email given wife campaign clinton puppet investig donald j trump stop therefbi deputi director andrew mccabe race clock retir full benefit day go donald j trump s baker reassign accord s donald j trump s dispos get inform fox news mccabe spent career fight terror attack socal presid trump factcheck claim wife receiv campaignpolitifact note late juli trump tweet andrew mccabe signific distort fact and implic mccabe got clinton polit favor make much sens look evid hi juli tweet rate mostli fals but trump repeat lie know support believ without bother googl it still lie thoughphoto zach gibson imag,News,23-Dec-17,1
" Trump Said Some INSANELY Racist Stuff Inside The Oval Office, And Witnesses Back It Up",in wake yet anoth court decis derail donald trump plan bar muslim enter unit state new york time publish report saturday morn detail presid frustrat get way far back frustrat goesaccord articl back june trump stomp oval offic furiou state travel ban thought would implement fulli place then instead fume visa alreadi issu immigr rate friend call say look like fool make broad pronouncementsit trump began read document top advisor note white supremacist stephen miller hand meet cabinet the page list mani visa issu year includ afghanistan a countri travel ban haiti also includ nigeria sens pattern yet trump express dismay eachaccord wit room spoke time condit anonym interview along three dozen other articl trump call countri fault read afghanistan terrorist haven peopl nigeria would never go back hut saw glori america immigr haiti aid despit extens research done newspap white hous cours deni languag usedbut given trump racist histori advisor stephen miller blatant white nation would surpris freedom inform act request turn document question statement print inlin commentari presid punctuat anger with it miller all respons american carnag speech trump deliv inaugurationthi racist menac america repres anyth countri stand for let hope indict robert mueller way speakfeatur imag via chri imag,News,23-Dec-17,1
" Former CIA Director Slams Trump Over UN Bullying, Openly Suggests He’s Acting Like A Dictator (TWEET)",mani peopl rais alarm regard fact donald trump danger close becom autocrat the thing is democraci becom autocraci right peopl nose often look like democraci begin phase thi explain republican david frum coupl month donald trump presid piec the atlant call how build autocraci in fact realli look critic happen right systemat discredit vital institut free press feder bureau investig well direct weapon depart justic order go trump former polit oppon democrat nomine hillari clinton make autocraci we well way further one chamber congress hous repres alreadi rogu band republican run parallel investig offici russian collus investig explicit intent undermin discredit idea trump could possibl done anyth wrong russian order swing elect favoral starter too now trump make unit nation ambassador nikki haley bulli threaten countri unit nation vote trump decis chang us polici come recognit jerusalem capit jewish state well one expert usual quit measur enough trump autocrat antic former cia director john o brennan the season spi took trump favorit platform twitter blast decisiontrump admin threat retali nation exercis sovereign right un oppos us posit jerusalem beyond outrag show blind loyalti subservi everyon qualiti usual found narcissist veng autocrat john o brennan s correct cours trump behav like autocrat mani peopl nation asleep come danger age greatest threat democraci fabric republ american presid fellow american know gopl congress check trump suppos be it time get flip hous possibl senat resist meantim want save countri devolv someth look like russia north korea america alway know we alreadi well wayfeatur imag via brendan imag,News,22-Dec-17,1
 WATCH: Brand-New Pro-Trump Ad Features So Much A** Kissing It Will Make You Sick,just might thought get break watch peopl kiss donald trump ass stroke ego ad nauseam protrump group creat ad noth peopl even exact thing america first polici set releas ad call thank you presid trump christma day and well threw littl mouth tri watch thisbas spot noth peopl fawn trump stuff actual done the ad includ scene littl girl thank trump bring back merri christma never went away there even video presid obama say merri christma himself a man thank cut tax and america first say everyday american everywher thank trump great awesom presidentth best presidentnobodi ever done done he break kind record everi daybeliev usanyway word propaganda come mind watch thi that liter propaganda promot someon need kind promot anymor watch ad bullshit belowth way maga kowtow orang hitler disgust frighten the man done noth polici harm american thank him unfortun take obscen amount pain open eye see dupe con man bad hairdoand ongo need kind ador is best unbecom offic thi ad vilefeatur imag via al imag,News,21-Dec-17,1
" Papa John’s Founder Retires, Figures Out Racism Is Bad For Business",a centerpiec donald trump campaign presid white supremacist way that mani public feud get involv peopl color one favorit target is cours player nation footbal leagu dare exercis first amend right kneel nation anthem protest racist polic brutal well one person figur racism bad busi even get orang overlord elect the founder pizza chain papa john sthi man never right side histori number issu plu pizza suck but decid complain player protest sale realli drop turn racism pay know corpor bottom line therefor papa john schnatter longer ceo hack pizza chainbreak papa john founder john schnatter step ceo announc come week critic nfl protest ap busi news siness decemb the thing is peopl certainli allow polit opinion realiz opinion often come dire consequ especi one busi tri garner sale support peopl one would presum goal ceo s no one know whether pressur sharehold public outcri boycott even nfl anyth step down as right now know gone perhap futur ceo run compani inclus divers fabric call america after all guid symbol nation alway statu liberti bigot like trump schnatter past the rest us futur we surviv present get therefeatur imag via rob imag,News,21-Dec-17,1
 WATCH: Paul Ryan Just Told Us He Doesn’t Care About Struggling Families Living In Blue States,republican work overtim tri sell scam tax bill public someth directli target middleclass workingclass famili financi relief noth could truth get hammer repeatedli speak cnbc paul ryan go full throttl tri convinc us paltri save get actual wait big moneybut go usual talk point with smug look someon grew wealthi famili muster talk know ryan claim per year famili live paychecktopaycheck see extrem signific then decid amend say save might noth famili earn per year true peopl live new york california falsethos two state trump loyal subject insist strip vote total claim trump actual popular vote watch ryan complet dismiss struggl famili live blue state belowif live paychecktopaycheck half peopl countri got more tax cut next year noth paul ryan s reach comput televis wipe smug face it height arrog insult impli struggl famili either two statesfeatur imag via mark imag,News,21-Dec-17,1
 Bad News For Trump — Mitch McConnell Says No To Repealing Obamacare In 2018,republican seven year come viabl replac obamacar fail miser after take victori lap gift wealthi tax break wednesday donald trump look camera said we essenti repeal obamacar come someth much better obamacar repeal bill ad well like thing trump say true but former realiti show star could done order erad former presid obama signatur legisl would without offer alternativesen major leader mitch mcconnel told npr thi bipartisan year i hope new year go pivot becom cooper an obamacar repeal doa well obvious unabl complet repeal replac senat kentucki republican said we take look look like senat but i think probabl move issu npr reportsmcconnel hope focu instead stabil insur marketplac keep premium skyrocket earli month promis made moder republican sen susan collin main get support tax billon top mcconnel broke hous speaker paul ryan rwi approach pare back spend program like medicaid food stamp mcconnel told npr interest use senat budget rule allow republican cut entitl without consult democrat i think entitl chang sustain almost alway bipartisan mcconnel said the hous may differ agenda if democrat friend senat want join us tackl kind entitl reform i happi take look it thi come mitch mcconnel he know donald trump destroy gop it matter sen mcconnel we still recal say number one prioriti make sure presid obama oneterm presid well hope trump last full term funni worksphoto chip imag,News,21-Dec-17,1
" WATCH: Lindsey Graham Trashes Media For Portraying Trump As ‘Kooky,’ Forgets His Own Words",the media talk day trump republican parti scam tax bill well sheer obsequi trump cabinet member congress tax scam pass but media quit say trump want they analysi discuss day long rather prais grand achiev trump believ is the gop increasingli sound exactli like trump come media coverag coverag tax scam differ coverag trump gener changedtoday lindsey graham went media portray trump kook unfit offic they job tell truth though graham said you know concern american press endless endless attempt label guy kind kook fit presid jake tapper note never label trump way but point someth rather odd graham opinion take look short video clip belowlindsey graham today i concern media attempt label trump kook fit presidentlindsey graham i think kook i think crazi i think unfit offic tomthunkit smind decemb there is graham mouth he parrot himself in use exact word describ trump said media use today freudian slipfeatur imag via video screen captur,News,20-Dec-17,1
 Heiress To Disney Empire Knows GOP Scammed Us – SHREDS Them For Tax Bill,abigail disney heiress brass ovari profit gop tax scam bill fcking poor peopl over ms disney pen ope usa today rip gop new one alway cogniz incom wealth inequ in word donald trump paul ryan bob corker or mitch mcconnel she abigail disney dammit sinc elect ronald reagan gap rich poor grown dramat trickl econom turn caus trickl up write but noth brought problem inequ sharper focu current propos republican overhaul tax system disney say propos burdensom middl class decreas respons wealthi contribut common good and drop truth bomb we like truth bombsrepublican insist plan cut tax middl class truth meager save offset loss elsewher deduct longer allow loss medicaid medicar coverag less fund educ chop block order provid tax cut wealthi peopl like me there even tax break privat jet owner thi bill give tax cut also kill health insur million peopl disney wrote it let pass million children taxfre and friend privat jet they get tax cut too with suffoc educ system die infrastructur nation debt least trillion bigger social mobil far reach peopl like you disney continu but i abl stay comfort right i am doe strike fair no not thankyouverymuch but given bill written i think look lot like nightmar pirat caribbean disney wrote have i made angri yet i realli hope i made angri you be no one vote tax bill vote life mind but pay it watchthi disney heiress take stand gop tax bill even though go benefit nowthi snew decemb if democraci bunch peopl advoc selfinterest instead interest greater good democraci anarchi disney ad we need start vote act citizen though common good matter person wellb thi tax reform it heistphoto ralph imag burda media,News,20-Dec-17,1
PRESIDENT TRUMP PREDICTED THIS! Riots In Swedish Muslim No-Go Area Prove Trump’s Point [Video],,politics,21-Feb-17,1
OBAMA’S DOJ SUED Michigan City To Allow MEGA-MOSQUE In Majority Christian Residential Neighborhood…Call Jeff Sessions NOW To Stop This Insanity,there one way stop mosqu built wish citizen residenti area whose citizen compris mostli christian refuge fled iraq escap persecut hand muslim homeland call us doj ask new attorney gener jeff session review case today ask doj stop megamosqu built a citi peopl southeastern michigan gun islam pressur follow denial megamosqu residenti neighborhood popul larg christian refuge fled islam persecut iraqsterl height alreadi two mosqu third american islam commun center appli permit reject determin propos use incompat residenti area too much traffic littl park citi plan commiss decid vote mosqu septemb but decemb mosqu su citi obama justic depart join in claim real reason mosqu deni citi cave antimuslim bigotri commun now settlement deal head sterl height citi council tuesday even if council vote sign deal could costli citywatch attorney mosqu develop call reason mostli christian refuge iraq opposit mosqu built residenti neighborhood fake local resid fear bad deal someth similar obama dojorchestr deal forc upon nearbi pittsfield township michigan last year that town pay million local muslim deni permit islam school township employe order undergo sensit train assur never discrimin muslimsattorney gener jeff session could cancel similar deal take effect sterl height awar act quickli if citi council found cooper obama doj staff expedit consent order stick team citi go nut said dick manaserri spokesman secur michigan group form educ public shariah law differ american lawin last novemb presidenti elect donald trump carri sterl height normal democrat parti stronghold percent hillari clinton he also carri macomb counti home sterl height also democraticori countybut trump new ag session appar yet fulli control justic depart includ mani holdov obama administr whi els would jeff session dismiss obama doj lawsuit sterl height manaserri ask we told legal expert power simpli dismiss lawsuit a consent order typic impli wrongdo applic penalti when plan commiss deni mosqu permit septemb hundr sterl height resid gather outsid citi hall celebr that celebr caught video critic cite evid citi somehow bias muslim tom mitchel resid sterl height whose famili sinc he seen citi transform past coupl decad control call progress he avoid world democrat citi elect technic nonpartisan i feel left take over destroy commun i want becom anoth dearborn hamtramck and elect offici enabl takeov saidhamtramck mile south sterl height becam nation first citi muslimmajor citi council larg portion dearborn resembl middl eastern countri sign arab women walk street face veiledh said matter discrimin church deni build project past site close residenti hous they get feder govern sue citi simpli pick anoth site i truli believ one man mr session power throw consent decre engin obama depart justic that hope mitchel said in fact i know hundr us pray opportun get jeff session hand tuesday night sign overturn that sign tantamount consent bunch bigot sterl height call session press offic went unansw monday feder offic close presid day a stinger eye iraqi christian sterl heightsmitchel said other tri get word commun tuesday council meet includ agenda item propos settlement lawsuitbut citi council publish tuesdaynight agenda local legal newspap weekli sterl height sentri put notic offici websit late friday we found thi rush tri put togeth opposit stop citi sign document admiss guilt someth think commit mitchel said as local resid i gonna say discrimin sterl height we alreadi got two mosqu sikh templ buddhist templ mani divers hous worship citi call discriminatori unbeliev the unfortun thing is want plop right middl chaldean christian neighborhood mitchel ad somebodi plan that somebodi seek put stinger someon eye dr ramsay dass md presid american middl east christian congress said concern anoth mosqu built sterl height he concern big pictur polit pressur place small citi outofcontrol feder bureaucraci use coerciv tactic as american citizen entitl build mosqu i believ make law small citi town cannot fight polit financi dass told wndthe feder law use coerc citi approv mosqu even mosqu residenti neighborhood religion land use institut person act reluipa pass congress as wnd report obama administr use law increasingli commun deni mosqu less deni construct churchesnahren anweya spokesperson persecut middl eastern christian live michigan she appear fox news spoken congression hear christian persecut middl east her famili live michigan sinc escap iraq she said sterl height home nation second largest chaldean cathol commun iraqi christian they thought found safe haven find ancient nemesi middl eastern sunni muslim resettl counti want build mosqu right middl neighborhoodmost iraqi christian either chaldean cathol member even ancient christian sect assyrian church east the assyrian speak arama languag jesu my famili pretti patriot american assyrian christian both greatgrandfath crucifi muslim liter cross anweya told wnd and proud christian greatgrandfath use walk around larg gold cross around neck never tri hide it so see ancient persecutor show macomb counti en mass build mosqu top chaldean neighborhood traumat anweya said while live safe haven allow mosqu built like put us back iraq we left everyth behind start scratch watch follow us traumat said there mani muslim countri could take muslim refuge send here if treat fairli countri i would say let build mani mosqu want day far realiti she said muslim leader believ equal anyth say level mere pander gullibl local christian they believ equal even say do said show muslim countri christian treat percent equal whi christian degrad everi muslim countri in million christian iraq christian began thrive peopl would behead christian faith so said assyrian chaldean commun news islam center wish build midst these peopl go give christian faith anweya said where nation vulner even call christian anymor danger i believ when sword place neck late ad the christian iraq build church dearborn build mosqu sterl height if start build church dearborn i think would see protest come them read atwnd,politics,21-Feb-17,1
30 WORKERS FIRED For Skipping Work To Protest On Behalf Of Illegal Immigrants…Calls Employer Who Fired Them A “Racist” [VIDEO],the owner masonri busi colorado speak decis fire employe show work support last week day without immigr protestjim serowski owner jv masonri told cnn interview sunday noth wrong said warn employe consequ join protest movement actual took day offserowski said told employe if go stand believ will pay price on saturday serowski also spoke local cb news affili denver one employe made alleg termin felt like racism serowski deni decis termin worker way racial motiv said made decis employe violat compani polici show work he said decis put compani real bind shutdown two job site thursday due protest risk miss import construct deadlin they told nocallnoshow job serowski told news station it simpl,politics,20-Feb-17,1
